ID,Title,Authors,Year,Venue,Citations,URL,PDF URL,DOI,Abstract,Keywords,Included,Exclusion Reason,Extracted At
naturalprovergrounde-2022,NaturalProver: Grounded Mathematical Proof Generation with Language Models,S. Welleck; Jiacheng Liu; Ximing Lu; Hannaneh Hajishirzi; Yejin Choi,2022,Neural Information Processing Systems,85,https://www.semanticscholar.org/paper/d593b9b8d63426f0d6a795dd7f2294619bc03610,https://arxiv.org/pdf/2205.12910,10.48550/arXiv.2205.12910,"Theorem proving in natural mathematical language - the mixture of symbolic and natural language used by humans - plays a central role in mathematical advances and education, and tests aspects of reasoning that are core to intelligence. Yet it has remained underexplored with modern generative models. We study large-scale language models on two new generation tasks: suggesting the next step in a mathematical proof, and full proof generation. We develop NaturalProver, a language model that generates proofs by conditioning on background references (e.g. theorems and definitions that are either retrieved or human-provided), and optionally enforces their presence with constrained decoding. On theorems from the NaturalProofs benchmark, NaturalProver improves the quality of next-step suggestions and generated proofs over fine-tuned GPT-3, according to human evaluations from university-level mathematics students. NaturalProver is capable of proving some theorems that require short (2-6 step) proofs, and providing next-step suggestions that are rated as correct and useful over 40% of the time, which is to our knowledge the first demonstration of these capabilities using neural language models.",arxiv:2205.12910,Yes,,2025-11-11T02:48:05.506Z
numglueasuiteoffunda-2022,NumGLUE: A Suite of Fundamental yet Challenging Mathematical Reasoning Tasks,Swaroop Mishra; Arindam Mitra; Neeraj Varshney; Bhavdeep Singh Sachdeva; Peter Clark; Chitta Baral; A. Kalyan,2022,Annual Meeting of the Association for Computational Linguistics,118,https://www.semanticscholar.org/paper/39238a92de090c104936a4f78375b95600e42ce5,http://arxiv.org/pdf/2204.05660,10.48550/arXiv.2204.05660,"Given the ubiquitous nature of numbers in text, reasoning with numbers to perform simple calculations is an important skill of AI systems. While many datasets and models have been developed to this end, state-of-the-art AI systems are brittle; failing to perform the underlying mathematical reasoning when they appear in a slightly different scenario. Drawing inspiration from GLUE that was proposed in the context of natural language understanding, we propose NumGLUE, a multi-task benchmark that evaluates the performance of AI systems on eight different tasks, that at their core require simple arithmetic understanding. We show that this benchmark is far from being solved with neural models including state-of-the-art large-scale language models performing significantly worse than humans (lower by 46.4 %). Further, NumGLUE promotes sharing knowledge across tasks, especially those with limited training data as evidenced by the superior performance (average gain of 3.4 % on each task) when a model is jointly trained on all the tasks as opposed to task-specific modeling. Finally, we hope that NumGLUE will encourage systems that perform robust and general arithmetic reasoning within language, a first step towards being able to perform more complex mathematical reasoning.",arxiv:2204.05660,Yes,,2025-11-11T02:48:05.506Z
overcomingbarriersto-2022,Overcoming Barriers to Skill Injection in Language Modeling: Case Study in Arithmetic,Mandar Sharma; N. Muralidhar; Naren Ramakrishnan,2022,arXiv.org,6,https://www.semanticscholar.org/paper/1ec4ae64ded99846bcd8a1a3b16fe2875f55c7c1,http://arxiv.org/pdf/2211.02098,10.48550/arXiv.2211.02098,"Through their transfer learning abilities, highly-parameterized large pre-trained language models have dominated the NLP landscape for a multitude of downstream language tasks. Though linguistically proficient, the inability of these models to incorporate the learning of non-linguistic entities (numerals and arithmetic reasoning) limits their usage for tasks that require numeric comprehension or strict mathematical reasoning. However, as we illustrate in this paper, building a general purpose language model that also happens to be proficient in mathematical reasoning is not as straight-forward as training it on a numeric dataset. In this work, we develop a novel framework that enables language models to be mathematically proficient while retaining their linguistic prowess. Specifically, we offer information-theoretic interventions to overcome the catastrophic forgetting of linguistic skills that occurs while injecting non-linguistic skills into language models.",arxiv:2211.02098,Yes,,2025-11-11T02:48:05.506Z
planbenchanextensibl-2022,PlanBench: An Extensible Benchmark for Evaluating Large Language Models on Planning and Reasoning about Change,Karthik Valmeekam; Alberto Olmo; S. Sreedharan; Subbarao Kambhampati,2022,Neural Information Processing Systems,306,https://www.semanticscholar.org/paper/e850d4c0dad3aee3b8b40be5e5d5e5c31354d8cc,,,"Generating plans of action, and reasoning about change have long been considered a core competence of intelligent agents. It is thus no surprise that evaluating the planning and reasoning capabilities of large language models (LLMs) has become a hot topic of research. Most claims about LLM planning capabilities are however based on common sense tasks-where it becomes hard to tell whether LLMs are planning or merely retrieving from their vast world knowledge. There is a strong need for systematic and extensible planning benchmarks with sufficient diversity to evaluate whether LLMs have innate planning capabilities. Motivated by this, we propose PlanBench, an extensible benchmark suite based on the kinds of domains used in the automated planning community, especially in the International Planning Competition, to test the capabilities of LLMs in planning or reasoning about actions and change. PlanBench provides sufficient diversity in both the task domains and the specific planning capabilities. Our studies also show that on many critical capabilities-including plan generation-LLM performance falls quite short, even with the SOTA models. PlanBench can thus function as a useful marker of progress of LLMs in planning and reasoning.",arxiv:2206.10498,Yes,,2025-11-11T02:48:05.507Z
reactsynergizingreas-2022,ReAct: Synergizing Reasoning and Acting in Language Models,Shunyu Yao; Jeffrey Zhao; Dian Yu; Nan Du; Izhak Shafran; Karthik Narasimhan; Yuan Cao,2022,International Conference on Learning Representations,4452,https://www.semanticscholar.org/paper/99832586d55f540f603637e458a292406a0ed75d,,,"While large language models (LLMs) have demonstrated impressive capabilities across tasks in language understanding and interactive decision making, their abilities for reasoning (e.g. chain-of-thought prompting) and acting (e.g. action plan generation) have primarily been studied as separate topics. In this paper, we explore the use of LLMs to generate both reasoning traces and task-specific actions in an interleaved manner, allowing for greater synergy between the two: reasoning traces help the model induce, track, and update action plans as well as handle exceptions, while actions allow it to interface with external sources, such as knowledge bases or environments, to gather additional information. We apply our approach, named ReAct, to a diverse set of language and decision making tasks and demonstrate its effectiveness over state-of-the-art baselines, as well as improved human interpretability and trustworthiness over methods without reasoning or acting components. Concretely, on question answering (HotpotQA) and fact verification (Fever), ReAct overcomes issues of hallucination and error propagation prevalent in chain-of-thought reasoning by interacting with a simple Wikipedia API, and generates human-like task-solving trajectories that are more interpretable than baselines without reasoning traces. On two interactive decision making benchmarks (ALFWorld and WebShop), ReAct outperforms imitation and reinforcement learning methods by an absolute success rate of 34% and 10% respectively, while being prompted with only one or two in-context examples. Project site with code: https://react-lm.github.io",arxiv:2210.03629,Yes,,2025-11-11T02:48:05.506Z
responsiblereasoning-2022,Responsible Reasoning with Large Language Models and the Impact of Proper Nouns,Sumit Kumar Jha,2022,,6,https://www.semanticscholar.org/paper/a70fcd82d8d26bf4c8b0bdde88e96b6ce2c80ecf,,,,,Yes,,2025-11-11T02:48:05.506Z
rethinkingwithretrie-2022,Rethinking with Retrieval: Faithful Large Language Model Inference,Hangfeng He; Hongming Zhang; D. Roth,2022,arXiv.org,191,https://www.semanticscholar.org/paper/490d8006851b1562cfd9ec1f057471f2868289d1,http://arxiv.org/pdf/2301.00303,10.48550/arXiv.2301.00303,"Despite the success of large language models (LLMs) in various natural language processing (NLP) tasks, the stored knowledge in these models may inevitably be incomplete, out-of-date, or incorrect. This motivates the need to utilize external knowledge to assist LLMs. Unfortunately, current methods for incorporating external knowledge often require additional training or fine-tuning, which can be costly and may not be feasible for LLMs. To address this issue, we propose a novel post-processing approach, rethinking with retrieval (RR), which retrieves relevant external knowledge based on the decomposed reasoning steps obtained from the chain-of-thought (CoT) prompting. This lightweight approach does not require additional training or fine-tuning and is not limited by the input length of LLMs. We evaluate the effectiveness of RR through extensive experiments with GPT-3 on three complex reasoning tasks: commonsense reasoning, temporal reasoning, and tabular reasoning. Our results show that RR can produce more faithful explanations and improve the performance of LLMs.",arxiv:2301.00303,Yes,,2025-11-11T02:48:05.506Z
selectioninferenceex-2022,Selection-Inference: Exploiting Large Language Models for Interpretable Logical Reasoning,Antonia Creswell; M. Shanahan; I. Higgins,2022,International Conference on Learning Representations,408,https://www.semanticscholar.org/paper/d48b29889241551e1ee6622fa78c3fa4159255dd,,,"Large language models (LLMs) have been shown to be capable of impressive few-shot generalisation to new tasks. However, they still tend to perform poorly on multi-step logical reasoning problems. Here we carry out a comprehensive evaluation of LLMs on 50 tasks that probe different aspects of logical reasoning. We show that language models tend to perform fairly well at single step inference or entailment tasks, but struggle to chain together multiple reasoning steps to solve more complex problems. In light of this, we propose a Selection-Inference (SI) framework that exploits pre-trained LLMs as general processing modules, and alternates between selection and inference to generate a series of interpretable, casual reasoning steps leading to the final answer. We show that a 7B parameter LLM used within the SI framework in a 5-shot generalisation setting, with no fine-tuning, yields a performance improvement of over 100% compared to an equivalent vanilla baseline on a suite of 10 logical reasoning tasks. The same model in the same setting even outperforms a significantly larger 280B parameter baseline on the same suite of tasks. Moreover, answers produced by the SI framework are accompanied by a causal natural-language-based reasoning trace, which has important implications for the safety and trustworthiness of the system.",arxiv:2205.09712,Yes,,2025-11-11T02:48:05.506Z
selfconsistencyimpro-2022,Self-Consistency Improves Chain of Thought Reasoning in Language Models,Xuezhi Wang; Jason Wei; D. Schuurmans; Quoc Le; Ed H. Chi; Denny Zhou,2022,International Conference on Learning Representations,4975,https://www.semanticscholar.org/paper/5f19ae1135a9500940978104ec15a5b8751bc7d2,,,"Chain-of-thought prompting combined with pre-trained large language models has achieved encouraging results on complex reasoning tasks. In this paper, we propose a new decoding strategy, self-consistency, to replace the naive greedy decoding used in chain-of-thought prompting. It first samples a diverse set of reasoning paths instead of only taking the greedy one, and then selects the most consistent answer by marginalizing out the sampled reasoning paths. Self-consistency leverages the intuition that a complex reasoning problem typically admits multiple different ways of thinking leading to its unique correct answer. Our extensive empirical evaluation shows that self-consistency boosts the performance of chain-of-thought prompting with a striking margin on a range of popular arithmetic and commonsense reasoning benchmarks, including GSM8K (+17.9%), SVAMP (+11.0%), AQuA (+12.2%), StrategyQA (+6.4%) and ARC-challenge (+3.9%).",arxiv:2203.11171,Yes,,2025-11-11T02:48:05.506Z
structuredflexiblean-2022,"Structured, flexible, and robust: benchmarking and improving large language models towards more human-like behavior in out-of-distribution reasoning tasks",K. M. Collins; Catherine Wong; Jiahai Feng; Megan Wei; J. Tenenbaum,2022,Annual Meeting of the Cognitive Science Society,66,https://www.semanticscholar.org/paper/7ef9aafc68511afab5b287e62b754576ea37b4ce,http://arxiv.org/pdf/2205.05718,10.48550/arXiv.2205.05718,"Human language offers a powerful window into our thoughts -- we tell stories, give explanations, and express our beliefs and goals through words. Abundant evidence also suggests that language plays a developmental role in structuring our learning. Here, we ask: how much of human-like thinking can be captured by learning statistical patterns in language alone? We first contribute a new challenge benchmark for comparing humans and distributional large language models (LLMs). Our benchmark contains two problem-solving domains (planning and explanation generation) and is designed to require generalization to new, out-of-distribution problems expressed in language. We find that humans are far more robust than LLMs on this benchmark. Next, we propose a hybrid Parse-and-Solve model, which augments distributional LLMs with a structured symbolic reasoning module. We find that this model shows more robust adaptation to out-of-distribution planning problems, demonstrating the promise of hybrid AI models for more human-like reasoning.",arxiv:2205.05718,Yes,,2025-11-11T02:48:05.506Z
textgraphs2022shared-2022,TextGraphs 2022 Shared Task on Natural Language Premise Selection,Marco Valentino; Deborah Ferreira; Mokanarangan Thayaparan; André Freitas; Dmitry Ustalov,2022,Workshop on Graph-based Methods for Natural Language Processing,12,https://www.semanticscholar.org/paper/43845c54af0246baab17d572953e671487e1dcd1,,,,,Yes,,2025-11-11T02:48:05.506Z
thinksumprobabilisti-2022,ThinkSum: Probabilistic reasoning over sets using large language models,Batu Mehmet Ozturkler; Nikolay Malkin; Zhen Wang; N. Jojic,2022,Annual Meeting of the Association for Computational Linguistics,23,https://www.semanticscholar.org/paper/370cea8b4220917f45a69358c0303df71f5063c7,http://arxiv.org/pdf/2210.01293,10.48550/arXiv.2210.01293,"Large language models (LLMs) have a substantial capacity for high-level analogical reasoning: reproducing patterns in linear text that occur in their training data (zero-shot evaluation) or in the provided context (few-shot in-context learning). However, recent studies show that even the more advanced LLMs fail in scenarios that require reasoning over multiple objects or facts and making sequences of logical deductions. We propose a two-stage probabilistic inference paradigm, ThinkSum, which reasons over sets of objects or facts in a structured manner. In the first stage (Think – retrieval of associations), a LLM is queried in parallel over a set of phrases extracted from the prompt or an auxiliary model call. In the second stage (Sum – probabilistic inference or reasoning), the results of these queries are aggregated to make the final prediction. We demonstrate the possibilities and advantages of ThinkSum on the BIG-bench suite of LLM evaluation tasks, achieving improvements over the state of the art using GPT-family models on thirteen difficult tasks, often with far smaller model variants. We also compare and contrast ThinkSum with other proposed modifications to direct prompting of LLMs, such as variants of chain-of-thought prompting. Our results suggest that because the probabilistic inference in ThinkSum is performed outside of calls to the LLM, ThinkSum is less sensitive to prompt design, yields more interpretable predictions, and can be flexibly combined with latent variable models to extract structured knowledge from LLMs. Overall, our proposed paradigm represents a promising approach for enhancing the reasoning capabilities of LLMs.",arxiv:2210.01293,Yes,,2025-11-11T02:48:05.506Z
towardsreasoninginla-2022,Towards Reasoning in Large Language Models: A Survey,Jie Huang; K. Chang,2022,Annual Meeting of the Association for Computational Linguistics,758,https://www.semanticscholar.org/paper/db4ab91d5675c37795e719e997a2827d3d83cd45,http://arxiv.org/pdf/2212.10403,10.48550/arXiv.2212.10403,"Reasoning is a fundamental aspect of human intelligence that plays a crucial role in activities such as problem solving, decision making, and critical thinking. In recent years, large language models (LLMs) have made significant progress in natural language processing, and there is observation that these models may exhibit reasoning abilities when they are sufficiently large. However, it is not yet clear to what extent LLMs are capable of reasoning. This paper provides a comprehensive overview of the current state of knowledge on reasoning in LLMs, including techniques for improving and eliciting reasoning in these models, methods and benchmarks for evaluating reasoning abilities, findings and implications of previous research in this field, and suggestions on future directions. Our aim is to provide a detailed and up-to-date review of this topic and stimulate meaningful discussion and future work.",arxiv:2212.10403,Yes,,2025-11-11T02:48:05.506Z
unigeounifyinggeomet-2022,UniGeo: Unifying Geometry Logical Reasoning via Reformulating Mathematical Expression,Jiaqi Chen; Tong Li; Jinghui Qin; Pan Lu; Liang Lin; Chongyu Chen; Xiaodan Liang,2022,Conference on Empirical Methods in Natural Language Processing,133,https://www.semanticscholar.org/paper/72fce949725b20428e5f56247fef5c6bd1ce6154,https://arxiv.org/pdf/2212.02746,10.48550/arXiv.2212.02746,"Geometry problem solving is a well-recognized testbed for evaluating the high-level multi-modal reasoning capability of deep models. In most existing works, two main geometry problems: calculation and proving, are usually treated as two specific tasks, hindering a deep model to unify its reasoning capability on multiple math tasks. However, in essence, these two tasks have similar problem representations and overlapped math knowledge which can improve the understanding and reasoning ability of a deep model on both two tasks. Therefore, we construct a large-scale Unified Geometry problem benchmark, UniGeo, which contains 4,998 calculation problems and 9,543 proving problems. Each proving problem is annotated with a multi-step proof with reasons and mathematical expressions. The proof can be easily reformulated as a proving sequence that shares the same formats with the annotated program sequence for calculation problems. Naturally, we also present a unified multi-task Geometric Transformer framework, Geoformer, to tackle calculation and proving problems simultaneously in the form of sequence generation, which finally shows the reasoning ability can be improved on both two tasks by unifying formulation. Furthermore, we propose a Mathematical Expression Pretraining (MEP) method that aims to predict the mathematical expressions in the problem solution, thus improving the Geoformer model. Experiments on the UniGeo demonstrate that our proposed Geoformer obtains state-of-the-art performance by outperforming task-specific model NGS with over 5.6% and 3.2% accuracies on calculation and proving problems, respectively.",arxiv:2212.02746,Yes,,2025-11-11T02:48:05.506Z
