ID,Title,Authors,Year,Venue,Citations,URL,PDF URL,DOI,Abstract,Keywords,Included,Exclusion Reason,Extracted At
languagemodelsaregre-2022,Language Models Are Greedy Reasoners: A Systematic Formal Analysis of Chain-of-Thought,Abulhair Saparov; He He,2022,International Conference on Learning Representations,384,https://www.semanticscholar.org/paper/e7028cd7ea838ab8294ecf26d5a2c0dbb8cfa81a,http://arxiv.org/pdf/2210.01240,10.48550/arXiv.2210.01240,"Large language models (LLMs) have shown remarkable reasoning capabilities given chain-of-thought prompts (examples with intermediate reasoning steps). Existing benchmarks measure reasoning ability indirectly, by evaluating accuracy on downstream tasks such as mathematical reasoning. However, it is unclear how these models obtain the answers and whether they rely on simple heuristics rather than the generated chain-of-thought. To enable systematic exploration of the reasoning ability of LLMs, we present a new synthetic question-answering dataset called PrOntoQA, where each example is generated from a synthetic world model represented in first-order logic. This allows us to parse the generated chain-of-thought into symbolic proofs for formal analysis. Our analysis on InstructGPT and GPT-3 shows that LLMs are quite capable of making correct individual deduction steps, and so are generally capable of reasoning, even in fictional contexts. However, they have difficulty with proof planning: When multiple valid deduction steps are available, they are not able to systematically explore the different options.",arxiv:2210.01240,Yes,,2025-11-11T02:46:38.519Z
largelanguagemodelsc-2022,Large Language Models Can Self-Improve,Jiaxin Huang; S. Gu; Le Hou; Yuexin Wu; Xuezhi Wang; Hongkun Yu; Jiawei Han,2022,Conference on Empirical Methods in Natural Language Processing,708,https://www.semanticscholar.org/paper/3fa70115248377c3d1517c9f978791a296fbc1dd,http://arxiv.org/pdf/2210.11610,10.48550/arXiv.2210.11610,"Large Language Models (LLMs) have achieved excellent performances in various tasks. However, fine-tuning an LLM requires extensive supervision. Human, on the other hand, may improve their reasoning abilities by self-thinking without external inputs. In this work, we demonstrate that an LLM is also capable of self-improving with only unlabeled datasets. We use a pre-trained LLM to generate""high-confidence""rationale-augmented answers for unlabeled questions using Chain-of-Thought prompting and self-consistency, and fine-tune the LLM using those self-generated solutions as target outputs. We show that our approach improves the general reasoning ability of a 540B-parameter LLM (74.4%->82.1% on GSM8K, 78.2%->83.0% on DROP, 90.0%->94.4% on OpenBookQA, and 63.4%->67.9% on ANLI-A3) and achieves state-of-the-art-level performance, without any ground truth label. We conduct ablation studies and show that fine-tuning on reasoning is critical for self-improvement.",arxiv:2210.11610,Yes,,2025-11-11T02:46:38.519Z
largelanguagemodelsa-2022,Large Language Models are reasoners with Self-Verification,Yixuan Weng; Minjun Zhu; Bin Li; Shizhu He; Kang Liu; Jun Zhao,2022,arXiv.org,63,https://www.semanticscholar.org/paper/f02e8f1c9b5ab12ddfb1977570f9f5445a99a973,http://arxiv.org/pdf/2212.09561,10.48550/arXiv.2212.09561,,,Yes,,2025-11-11T02:46:38.519Z
largelanguagemodelse-2022,Large language models encode clinical knowledge,K. Singhal; Shekoofeh Azizi; T. Tu; S. Mahdavi; Jason Wei; Hyung Won Chung; Nathan Scales; A. Tanwani; H. Cole-Lewis; S. Pfohl; P. Payne; Martin G. Seneviratne; P. Gamble; C. Kelly; Nathaneal Scharli; A. Chowdhery; P. A. Mansfield; B. A. Y. Arcas; D. Webster; Greg S. Corrado; Yossi Matias; K. Chou; Juraj Gottweis; Nenad Tomašev; Yun Liu; A. Rajkomar; J. Barral; Christopher Semturs; A. Karthikesalingam; Vivek Natarajan,2022,Nature,3053,https://www.semanticscholar.org/paper/6052486bc9144dc1730c12bf35323af3792a1fd0,https://www.nature.com/articles/s41586-023-06291-2.pdf,10.1038/s41586-023-06291-2,"Med-PaLM, a state-of-the-art large language model for medicine, is introduced and evaluated across several medical question answering tasks, demonstrating the promise of these models in this domain. Large language models (LLMs) have demonstrated impressive capabilities, but the bar for clinical applications is high. Attempts to assess the clinical knowledge of models typically rely on automated evaluations based on limited benchmarks. Here, to address these limitations, we present MultiMedQA, a benchmark combining six existing medical question answering datasets spanning professional medicine, research and consumer queries and a new dataset of medical questions searched online, HealthSearchQA. We propose a human evaluation framework for model answers along multiple axes including factuality, comprehension, reasoning, possible harm and bias. In addition, we evaluate Pathways Language Model^ 1 (PaLM, a 540-billion parameter LLM) and its instruction-tuned variant, Flan-PaLM^ 2 on MultiMedQA. Using a combination of prompting strategies, Flan-PaLM achieves state-of-the-art accuracy on every MultiMedQA multiple-choice dataset (MedQA^ 3 , MedMCQA^ 4 , PubMedQA^ 5 and Measuring Massive Multitask Language Understanding (MMLU) clinical topics^ 6 ), including 67.6% accuracy on MedQA (US Medical Licensing Exam-style questions), surpassing the prior state of the art by more than 17%. However, human evaluation reveals key gaps. To resolve this, we introduce instruction prompt tuning, a parameter-efficient approach for aligning LLMs to new domains using a few exemplars. The resulting model, Med-PaLM, performs encouragingly, but remains inferior to clinicians. We show that comprehension, knowledge recall and reasoning improve with model scale and instruction prompt tuning, suggesting the potential utility of LLMs in medicine. Our human evaluations reveal limitations of today’s models, reinforcing the importance of both evaluation frameworks and method development in creating safe, helpful LLMs for clinical applications.",arxiv:2212.13138,Yes,,2025-11-11T02:46:38.519Z
learningtoreasonwith-2022,Learning to Reason With Relational Abstractions,A. Nam; Mengye Ren; Chelsea Finn; James L. McClelland,2022,arXiv.org,5,https://www.semanticscholar.org/paper/6d5555348f453bac901c5b57e8a4eeb3074b4071,https://arxiv.org/pdf/2210.02615,10.48550/arXiv.2210.02615,"Large language models have recently shown promising progress in mathematical reasoning when fine-tuned with human-generated sequences walking through a sequence of solution steps. However, the solution sequences are not formally structured and the resulting model-generated sequences may not reflect the kind of systematic reasoning we might expect an expert human to produce. In this paper, we study how to build stronger reasoning capability in language models using the idea of relational abstractions. We introduce new types of sequences that more explicitly provide an abstract characterization of the transitions through intermediate solution steps to the goal state. We find that models that are supplied with such sequences as prompts can solve tasks with a significantly higher accuracy, and models that are trained to produce such sequences solve problems better than those that are trained with previously used human-generated sequences and other baselines. Our work thus takes several steps toward elucidating and improving how language models perform on tasks requiring multi-step mathematical reasoning.",arxiv:2210.02615,Yes,,2025-11-11T02:46:38.519Z
leasttomostprompting-2022,Least-to-Most Prompting Enables Complex Reasoning in Large Language Models,Denny Zhou; Nathanael Scharli; Le Hou; Jason Wei; Nathan Scales; Xuezhi Wang; D. Schuurmans; O. Bousquet; Quoc Le; Ed H. Chi,2022,International Conference on Learning Representations,1366,https://www.semanticscholar.org/paper/5437e8adab596d7294124c0e798708e050e25321,http://arxiv.org/pdf/2205.10625,10.48550/arXiv.2205.10625,"Chain-of-thought prompting has demonstrated remarkable performance on various natural language reasoning tasks. However, it tends to perform poorly on tasks which requires solving problems harder than the exemplars shown in the prompts. To overcome this challenge of easy-to-hard generalization, we propose a novel prompting strategy, least-to-most prompting. The key idea in this strategy is to break down a complex problem into a series of simpler subproblems and then solve them in sequence. Solving each subproblem is facilitated by the answers to previously solved subproblems. Our experimental results on tasks related to symbolic manipulation, compositional generalization, and math reasoning reveal that least-to-most prompting is capable of generalizing to more difficult problems than those seen in the prompts. A notable finding is that when the GPT-3 code-davinci-002 model is used with least-to-most prompting, it can solve the compositional generalization benchmark SCAN in any split (including length split) with an accuracy of at least 99% using just 14 exemplars, compared to only 16% accuracy with chain-of-thought prompting. This is particularly noteworthy because neural-symbolic models in the literature that specialize in solving SCAN are trained on the entire training set containing over 15,000 examples. We have included prompts for all the tasks in the Appendix.",arxiv:2205.10625,Yes,,2025-11-11T02:46:38.519Z
legalpromptingteachi-2022,Legal Prompting: Teaching a Language Model to Think Like a Lawyer,Fang Yu; Lee Quartey; Frank Schilder,2022,arXiv.org,81,https://www.semanticscholar.org/paper/cc43306e22dbfd5bc35251ab8c8ba37e4fc2a1b3,http://arxiv.org/pdf/2212.01326,10.48550/arXiv.2212.01326,"Large language models that are capable of zero or few-shot prompting approaches have given rise to the new research area of prompt engineering. Recent advances showed that for example Chain-of-Thought (CoT) prompts can improve arithmetic or common sense tasks significantly. We explore how such approaches fare with legal reasoning tasks and take the COLIEE entailment task based on the Japanese Bar exam for testing zero-shot/few-shot and fine-tuning approaches. Our findings show that while CoT prompting and fine-tuning with explanations approaches show improvements, the best results are produced by prompts that are derived from specific legal reasoning techniques such as IRAC (Issue, Rule, Application, Conclusion). Based on our experiments we improve the 2021 best result from 0.7037 accuracy to 0.8148 accuracy and beat the 2022 best system of 0.6789 accuracy with an accuracy of 0.7431.",arxiv:2212.01326,Yes,,2025-11-11T02:46:38.519Z
mrklsystemsamodularn-2022,"MRKL Systems: A modular, neuro-symbolic architecture that combines large language models, external knowledge sources and discrete reasoning",Ehud Karpas; Omri Abend; Yonatan Belinkov; Barak Lenz; Opher Lieber; Nir Ratner; Y. Shoham; Hofit Bata; Yoav Levine; Kevin Leyton-Brown; Dor Muhlgay; N. Rozen; Erez Schwartz; Gal Shachaf; Shai Shalev-Shwartz; A. Shashua; Moshe Tenenholtz,2022,arXiv.org,93,https://www.semanticscholar.org/paper/1bcde55995a957b3e8a595d536b816cb8989cf1d,http://arxiv.org/pdf/2205.00445,10.48550/arXiv.2205.00445,"Huge language models (LMs) have ushered in a new era for AI, serving as a gateway to natural-language-based knowledge tasks. Although an essential element of modern AI, LMs are also inherently limited in a number of ways. We discuss these limitations and how they can be avoided by adopting a systems approach. Conceptualizing the challenge as one that involves knowledge and reasoning in addition to linguistic processing, we define a flexible architecture with multiple neural models, complemented by discrete knowledge and reasoning modules. We describe this neuro-symbolic architecture, dubbed the Modular Reasoning, Knowledge and Language (MRKL, pronounced""miracle"") system, some of the technical challenges in implementing it, and Jurassic-X, AI21 Labs' MRKL system implementation.",arxiv:2205.00445,Yes,,2025-11-11T02:46:38.519Z
mindseyegroundedlang-2022,Mind's Eye: Grounded Language Model Reasoning through Simulation,Ruibo Liu; Jason Wei; S. Gu; Te-Yen Wu; Soroush Vosoughi; Claire Cui; Denny Zhou; Andrew M. Dai,2022,International Conference on Learning Representations,89,https://www.semanticscholar.org/paper/2cb97b2bb6ab2eb17add9ffe69d5cbeaca2b29c8,http://arxiv.org/pdf/2210.05359,10.48550/arXiv.2210.05359,"Successful and effective communication between humans and AI relies on a shared experience of the world. By training solely on written text, current language models (LMs) miss the grounded experience of humans in the real-world -- their failure to relate language to the physical world causes knowledge to be misrepresented and obvious mistakes in their reasoning. We present Mind's Eye, a paradigm to ground language model reasoning in the physical world. Given a physical reasoning question, we use a computational physics engine (DeepMind's MuJoCo) to simulate the possible outcomes, and then use the simulation results as part of the input, which enables language models to perform reasoning. Experiments on 39 tasks in a physics alignment benchmark demonstrate that Mind's Eye can improve reasoning ability by a large margin (27.9% zero-shot, and 46.0% few-shot absolute accuracy improvement on average). Smaller language models armed with Mind's Eye can obtain similar performance to models that are 100x larger. Finally, we confirm the robustness of Mind's Eye through ablation studies.",arxiv:2210.05359,Yes,,2025-11-11T02:46:38.519Z
naturalprovergrounde-2022,NaturalProver: Grounded Mathematical Proof Generation with Language Models,S. Welleck; Jiacheng Liu; Ximing Lu; Hannaneh Hajishirzi; Yejin Choi,2022,Neural Information Processing Systems,85,https://www.semanticscholar.org/paper/d593b9b8d63426f0d6a795dd7f2294619bc03610,https://arxiv.org/pdf/2205.12910,10.48550/arXiv.2205.12910,"Theorem proving in natural mathematical language - the mixture of symbolic and natural language used by humans - plays a central role in mathematical advances and education, and tests aspects of reasoning that are core to intelligence. Yet it has remained underexplored with modern generative models. We study large-scale language models on two new generation tasks: suggesting the next step in a mathematical proof, and full proof generation. We develop NaturalProver, a language model that generates proofs by conditioning on background references (e.g. theorems and definitions that are either retrieved or human-provided), and optionally enforces their presence with constrained decoding. On theorems from the NaturalProofs benchmark, NaturalProver improves the quality of next-step suggestions and generated proofs over fine-tuned GPT-3, according to human evaluations from university-level mathematics students. NaturalProver is capable of proving some theorems that require short (2-6 step) proofs, and providing next-step suggestions that are rated as correct and useful over 40% of the time, which is to our knowledge the first demonstration of these capabilities using neural language models.",arxiv:2205.12910,Yes,,2025-11-11T02:46:38.519Z
numglueasuiteoffunda-2022,NumGLUE: A Suite of Fundamental yet Challenging Mathematical Reasoning Tasks,Swaroop Mishra; Arindam Mitra; Neeraj Varshney; Bhavdeep Singh Sachdeva; Peter Clark; Chitta Baral; A. Kalyan,2022,Annual Meeting of the Association for Computational Linguistics,118,https://www.semanticscholar.org/paper/39238a92de090c104936a4f78375b95600e42ce5,http://arxiv.org/pdf/2204.05660,10.48550/arXiv.2204.05660,"Given the ubiquitous nature of numbers in text, reasoning with numbers to perform simple calculations is an important skill of AI systems. While many datasets and models have been developed to this end, state-of-the-art AI systems are brittle; failing to perform the underlying mathematical reasoning when they appear in a slightly different scenario. Drawing inspiration from GLUE that was proposed in the context of natural language understanding, we propose NumGLUE, a multi-task benchmark that evaluates the performance of AI systems on eight different tasks, that at their core require simple arithmetic understanding. We show that this benchmark is far from being solved with neural models including state-of-the-art large-scale language models performing significantly worse than humans (lower by 46.4 %). Further, NumGLUE promotes sharing knowledge across tasks, especially those with limited training data as evidenced by the superior performance (average gain of 3.4 % on each task) when a model is jointly trained on all the tasks as opposed to task-specific modeling. Finally, we hope that NumGLUE will encourage systems that perform robust and general arithmetic reasoning within language, a first step towards being able to perform more complex mathematical reasoning.",arxiv:2204.05660,Yes,,2025-11-11T02:46:38.519Z
optimlscalinglanguag-2022,OPT-IML: Scaling Language Model Instruction Meta Learning through the Lens of Generalization,S. Iyer; Xi Victoria Lin; Ramakanth Pasunuru; Todor Mihaylov; Daniel Simig; Ping Yu; Kurt Shuster; Tianlu Wang; Qing Liu; Punit Singh Koura; Xian Li; Brian O'Horo; Gabriel Pereyra; Jeff Wang; Christopher Dewan; Asli Celikyilmaz; Luke S. Zettlemoyer; Veselin Stoyanov,2022,arXiv.org,291,https://www.semanticscholar.org/paper/e965e93e76a9e6c4e4863d145b5c007b540d575d,,,"Recent work has shown that fine-tuning large pre-trained language models on a collection of tasks described via instructions, a.k.a. instruction-tuning, improves their zero and few-shot generalization to unseen tasks. However, there is a limited understanding of the performance trade-offs of different decisions made during the instruction-tuning process. These decisions include the scale and diversity of the instruction-tuning benchmark, different task sampling strategies, fine-tuning with and without demonstrations, training using specialized datasets for reasoning and dialogue, and finally, the fine-tuning objectives themselves. In this paper, we characterize the effect of instruction-tuning decisions on downstream task performance when scaling both model and benchmark sizes. To this end, we create OPT-IML Bench: a large benchmark for Instruction Meta-Learning (IML) of 2000 NLP tasks consolidated into task categories from 8 existing benchmarks, and prepare an evaluation framework to measure three types of model generalizations: to tasks from fully held-out categories, to held-out tasks from seen categories, and to held-out instances from seen tasks. Through the lens of this framework, we first present insights about instruction-tuning decisions as applied to OPT-30B and further exploit these insights to train OPT-IML 30B and 175B, which are instruction-tuned versions of OPT. OPT-IML demonstrates all three generalization abilities at both scales on four different evaluation benchmarks with diverse tasks and input formats -- PromptSource, FLAN, Super-NaturalInstructions, and UnifiedSKG. Not only does it significantly outperform OPT on all benchmarks but is also highly competitive with existing models fine-tuned on each specific benchmark. We release OPT-IML at both scales, together with the OPT-IML Bench evaluation framework.",arxiv:2212.12017,Yes,,2025-11-11T02:46:38.519Z
overcomingbarriersto-2022,Overcoming Barriers to Skill Injection in Language Modeling: Case Study in Arithmetic,Mandar Sharma; N. Muralidhar; Naren Ramakrishnan,2022,arXiv.org,6,https://www.semanticscholar.org/paper/1ec4ae64ded99846bcd8a1a3b16fe2875f55c7c1,http://arxiv.org/pdf/2211.02098,10.48550/arXiv.2211.02098,"Through their transfer learning abilities, highly-parameterized large pre-trained language models have dominated the NLP landscape for a multitude of downstream language tasks. Though linguistically proficient, the inability of these models to incorporate the learning of non-linguistic entities (numerals and arithmetic reasoning) limits their usage for tasks that require numeric comprehension or strict mathematical reasoning. However, as we illustrate in this paper, building a general purpose language model that also happens to be proficient in mathematical reasoning is not as straight-forward as training it on a numeric dataset. In this work, we develop a novel framework that enables language models to be mathematically proficient while retaining their linguistic prowess. Specifically, we offer information-theoretic interventions to overcome the catastrophic forgetting of linguistic skills that occurs while injecting non-linguistic skills into language models.",arxiv:2211.02098,Yes,,2025-11-11T02:46:38.519Z
planbenchanextensibl-2022,PlanBench: An Extensible Benchmark for Evaluating Large Language Models on Planning and Reasoning about Change,Karthik Valmeekam; Alberto Olmo; S. Sreedharan; Subbarao Kambhampati,2022,Neural Information Processing Systems,306,https://www.semanticscholar.org/paper/e850d4c0dad3aee3b8b40be5e5d5e5c31354d8cc,,,"Generating plans of action, and reasoning about change have long been considered a core competence of intelligent agents. It is thus no surprise that evaluating the planning and reasoning capabilities of large language models (LLMs) has become a hot topic of research. Most claims about LLM planning capabilities are however based on common sense tasks-where it becomes hard to tell whether LLMs are planning or merely retrieving from their vast world knowledge. There is a strong need for systematic and extensible planning benchmarks with sufficient diversity to evaluate whether LLMs have innate planning capabilities. Motivated by this, we propose PlanBench, an extensible benchmark suite based on the kinds of domains used in the automated planning community, especially in the International Planning Competition, to test the capabilities of LLMs in planning or reasoning about actions and change. PlanBench provides sufficient diversity in both the task domains and the specific planning capabilities. Our studies also show that on many critical capabilities-including plan generation-LLM performance falls quite short, even with the SOTA models. PlanBench can thus function as a useful marker of progress of LLMs in planning and reasoning.",arxiv:2206.10498,Yes,,2025-11-11T02:46:38.519Z
reactsynergizingreas-2022,ReAct: Synergizing Reasoning and Acting in Language Models,Shunyu Yao; Jeffrey Zhao; Dian Yu; Nan Du; Izhak Shafran; Karthik Narasimhan; Yuan Cao,2022,International Conference on Learning Representations,4452,https://www.semanticscholar.org/paper/99832586d55f540f603637e458a292406a0ed75d,,,"While large language models (LLMs) have demonstrated impressive capabilities across tasks in language understanding and interactive decision making, their abilities for reasoning (e.g. chain-of-thought prompting) and acting (e.g. action plan generation) have primarily been studied as separate topics. In this paper, we explore the use of LLMs to generate both reasoning traces and task-specific actions in an interleaved manner, allowing for greater synergy between the two: reasoning traces help the model induce, track, and update action plans as well as handle exceptions, while actions allow it to interface with external sources, such as knowledge bases or environments, to gather additional information. We apply our approach, named ReAct, to a diverse set of language and decision making tasks and demonstrate its effectiveness over state-of-the-art baselines, as well as improved human interpretability and trustworthiness over methods without reasoning or acting components. Concretely, on question answering (HotpotQA) and fact verification (Fever), ReAct overcomes issues of hallucination and error propagation prevalent in chain-of-thought reasoning by interacting with a simple Wikipedia API, and generates human-like task-solving trajectories that are more interpretable than baselines without reasoning traces. On two interactive decision making benchmarks (ALFWorld and WebShop), ReAct outperforms imitation and reinforcement learning methods by an absolute success rate of 34% and 10% respectively, while being prompted with only one or two in-context examples. Project site with code: https://react-lm.github.io",arxiv:2210.03629,Yes,,2025-11-11T02:46:38.519Z
responsiblereasoning-2022,Responsible Reasoning with Large Language Models and the Impact of Proper Nouns,Sumit Kumar Jha,2022,,6,https://www.semanticscholar.org/paper/a70fcd82d8d26bf4c8b0bdde88e96b6ce2c80ecf,,,,,Yes,,2025-11-11T02:46:38.519Z
rethinkingwithretrie-2022,Rethinking with Retrieval: Faithful Large Language Model Inference,Hangfeng He; Hongming Zhang; D. Roth,2022,arXiv.org,191,https://www.semanticscholar.org/paper/490d8006851b1562cfd9ec1f057471f2868289d1,http://arxiv.org/pdf/2301.00303,10.48550/arXiv.2301.00303,"Despite the success of large language models (LLMs) in various natural language processing (NLP) tasks, the stored knowledge in these models may inevitably be incomplete, out-of-date, or incorrect. This motivates the need to utilize external knowledge to assist LLMs. Unfortunately, current methods for incorporating external knowledge often require additional training or fine-tuning, which can be costly and may not be feasible for LLMs. To address this issue, we propose a novel post-processing approach, rethinking with retrieval (RR), which retrieves relevant external knowledge based on the decomposed reasoning steps obtained from the chain-of-thought (CoT) prompting. This lightweight approach does not require additional training or fine-tuning and is not limited by the input length of LLMs. We evaluate the effectiveness of RR through extensive experiments with GPT-3 on three complex reasoning tasks: commonsense reasoning, temporal reasoning, and tabular reasoning. Our results show that RR can produce more faithful explanations and improve the performance of LLMs.",arxiv:2301.00303,Yes,,2025-11-11T02:46:38.519Z
