ID,Title,Authors,Year,Venue,Citations,URL,PDF URL,DOI,Abstract,Keywords,Included,Exclusion Reason,Extracted At
selectioninferenceex-2022,Selection-Inference: Exploiting Large Language Models for Interpretable Logical Reasoning,Antonia Creswell; M. Shanahan; I. Higgins,2022,International Conference on Learning Representations,408,https://www.semanticscholar.org/paper/d48b29889241551e1ee6622fa78c3fa4159255dd,,,"Large language models (LLMs) have been shown to be capable of impressive few-shot generalisation to new tasks. However, they still tend to perform poorly on multi-step logical reasoning problems. Here we carry out a comprehensive evaluation of LLMs on 50 tasks that probe different aspects of logical reasoning. We show that language models tend to perform fairly well at single step inference or entailment tasks, but struggle to chain together multiple reasoning steps to solve more complex problems. In light of this, we propose a Selection-Inference (SI) framework that exploits pre-trained LLMs as general processing modules, and alternates between selection and inference to generate a series of interpretable, casual reasoning steps leading to the final answer. We show that a 7B parameter LLM used within the SI framework in a 5-shot generalisation setting, with no fine-tuning, yields a performance improvement of over 100% compared to an equivalent vanilla baseline on a suite of 10 logical reasoning tasks. The same model in the same setting even outperforms a significantly larger 280B parameter baseline on the same suite of tasks. Moreover, answers produced by the SI framework are accompanied by a causal natural-language-based reasoning trace, which has important implications for the safety and trustworthiness of the system.",arxiv:2205.09712,Yes,,2025-11-11T02:46:38.519Z
selfconsistencyimpro-2022,Self-Consistency Improves Chain of Thought Reasoning in Language Models,Xuezhi Wang; Jason Wei; D. Schuurmans; Quoc Le; Ed H. Chi; Denny Zhou,2022,International Conference on Learning Representations,4975,https://www.semanticscholar.org/paper/5f19ae1135a9500940978104ec15a5b8751bc7d2,,,"Chain-of-thought prompting combined with pre-trained large language models has achieved encouraging results on complex reasoning tasks. In this paper, we propose a new decoding strategy, self-consistency, to replace the naive greedy decoding used in chain-of-thought prompting. It first samples a diverse set of reasoning paths instead of only taking the greedy one, and then selects the most consistent answer by marginalizing out the sampled reasoning paths. Self-consistency leverages the intuition that a complex reasoning problem typically admits multiple different ways of thinking leading to its unique correct answer. Our extensive empirical evaluation shows that self-consistency boosts the performance of chain-of-thought prompting with a striking margin on a range of popular arithmetic and commonsense reasoning benchmarks, including GSM8K (+17.9%), SVAMP (+11.0%), AQuA (+12.2%), StrategyQA (+6.4%) and ARC-challenge (+3.9%).",arxiv:2203.11171,Yes,,2025-11-11T02:46:38.519Z
solvingquantitativer-2022,Solving Quantitative Reasoning Problems with Language Models,Aitor Lewkowycz; Anders Andreassen; David Dohan; Ethan Dyer; H. Michalewski; V. Ramasesh; Ambrose Slone; Cem Anil; Imanol Schlag; Theo Gutman-Solo; Yuhuai Wu; Behnam Neyshabur; Guy Gur-Ari; Vedant Misra,2022,Neural Information Processing Systems,1192,https://www.semanticscholar.org/paper/ab0e3d3e4d42369de5933a3b4c237780b41c0d77,http://arxiv.org/pdf/2206.14858,10.48550/arXiv.2206.14858,"Language models have achieved remarkable performance on a wide range of tasks that require natural language understanding. Nevertheless, state-of-the-art models have generally struggled with tasks that require quantitative reasoning, such as solving mathematics, science, and engineering problems at the college level. To help close this gap, we introduce Minerva, a large language model pretrained on general natural language data and further trained on technical content. The model achieves state-of-the-art performance on technical benchmarks without the use of external tools. We also evaluate our model on over two hundred undergraduate-level problems in physics, biology, chemistry, economics, and other sciences that require quantitative reasoning, and find that the model can correctly answer nearly a third of them.",arxiv:2206.14858,Yes,,2025-11-11T02:46:38.519Z
structuredflexiblean-2022,"Structured, flexible, and robust: benchmarking and improving large language models towards more human-like behavior in out-of-distribution reasoning tasks",K. M. Collins; Catherine Wong; Jiahai Feng; Megan Wei; J. Tenenbaum,2022,Annual Meeting of the Cognitive Science Society,66,https://www.semanticscholar.org/paper/7ef9aafc68511afab5b287e62b754576ea37b4ce,http://arxiv.org/pdf/2205.05718,10.48550/arXiv.2205.05718,"Human language offers a powerful window into our thoughts -- we tell stories, give explanations, and express our beliefs and goals through words. Abundant evidence also suggests that language plays a developmental role in structuring our learning. Here, we ask: how much of human-like thinking can be captured by learning statistical patterns in language alone? We first contribute a new challenge benchmark for comparing humans and distributional large language models (LLMs). Our benchmark contains two problem-solving domains (planning and explanation generation) and is designed to require generalization to new, out-of-distribution problems expressed in language. We find that humans are far more robust than LLMs on this benchmark. Next, we propose a hybrid Parse-and-Solve model, which augments distributional LLMs with a structured symbolic reasoning module. We find that this model shows more robust adaptation to out-of-distribution planning problems, demonstrating the promise of hybrid AI models for more human-like reasoning.",arxiv:2205.05718,Yes,,2025-11-11T02:46:38.519Z
textgraphs2022shared-2022,TextGraphs 2022 Shared Task on Natural Language Premise Selection,Marco Valentino; Deborah Ferreira; Mokanarangan Thayaparan; André Freitas; Dmitry Ustalov,2022,Workshop on Graph-based Methods for Natural Language Processing,12,https://www.semanticscholar.org/paper/43845c54af0246baab17d572953e671487e1dcd1,,,,,Yes,,2025-11-11T02:46:38.519Z
thinksumprobabilisti-2022,ThinkSum: Probabilistic reasoning over sets using large language models,Batu Mehmet Ozturkler; Nikolay Malkin; Zhen Wang; N. Jojic,2022,Annual Meeting of the Association for Computational Linguistics,23,https://www.semanticscholar.org/paper/370cea8b4220917f45a69358c0303df71f5063c7,http://arxiv.org/pdf/2210.01293,10.48550/arXiv.2210.01293,"Large language models (LLMs) have a substantial capacity for high-level analogical reasoning: reproducing patterns in linear text that occur in their training data (zero-shot evaluation) or in the provided context (few-shot in-context learning). However, recent studies show that even the more advanced LLMs fail in scenarios that require reasoning over multiple objects or facts and making sequences of logical deductions. We propose a two-stage probabilistic inference paradigm, ThinkSum, which reasons over sets of objects or facts in a structured manner. In the first stage (Think – retrieval of associations), a LLM is queried in parallel over a set of phrases extracted from the prompt or an auxiliary model call. In the second stage (Sum – probabilistic inference or reasoning), the results of these queries are aggregated to make the final prediction. We demonstrate the possibilities and advantages of ThinkSum on the BIG-bench suite of LLM evaluation tasks, achieving improvements over the state of the art using GPT-family models on thirteen difficult tasks, often with far smaller model variants. We also compare and contrast ThinkSum with other proposed modifications to direct prompting of LLMs, such as variants of chain-of-thought prompting. Our results suggest that because the probabilistic inference in ThinkSum is performed outside of calls to the LLM, ThinkSum is less sensitive to prompt design, yields more interpretable predictions, and can be flexibly combined with latent variable models to extract structured knowledge from LLMs. Overall, our proposed paradigm represents a promising approach for enhancing the reasoning capabilities of LLMs.",arxiv:2210.01293,Yes,,2025-11-11T02:46:38.519Z
towardsreasoninginla-2022,Towards Reasoning in Large Language Models: A Survey,Jie Huang; K. Chang,2022,Annual Meeting of the Association for Computational Linguistics,758,https://www.semanticscholar.org/paper/db4ab91d5675c37795e719e997a2827d3d83cd45,http://arxiv.org/pdf/2212.10403,10.48550/arXiv.2212.10403,"Reasoning is a fundamental aspect of human intelligence that plays a crucial role in activities such as problem solving, decision making, and critical thinking. In recent years, large language models (LLMs) have made significant progress in natural language processing, and there is observation that these models may exhibit reasoning abilities when they are sufficiently large. However, it is not yet clear to what extent LLMs are capable of reasoning. This paper provides a comprehensive overview of the current state of knowledge on reasoning in LLMs, including techniques for improving and eliciting reasoning in these models, methods and benchmarks for evaluating reasoning abilities, findings and implications of previous research in this field, and suggestions on future directions. Our aim is to provide a detailed and up-to-date review of this topic and stimulate meaningful discussion and future work.",arxiv:2212.10403,Yes,,2025-11-11T02:46:38.519Z
towardsamathematicsf-2022,Towards a Mathematics Formalisation Assistant using Large Language Models,Ayush Agrawal; Siddhartha Gadgil; Navin Goyal; Ashvni Narayanan; Anand Tadipatri,2022,arXiv.org,18,https://www.semanticscholar.org/paper/b1eebb2df3b9ff7ff2b00fb1a786f6ada2caebce,https://arxiv.org/pdf/2211.07524,10.48550/arXiv.2211.07524,"Mathematics formalisation is the task of writing mathematics (i.e., definitions, theorem statements, proofs) in natural language, as found in books and papers, into a formal language that can then be checked for correctness by a program. It is a thriving activity today, however formalisation remains cumbersome. In this paper, we explore the abilities of a large language model (Codex) to help with formalisation in the Lean theorem prover. We find that with careful inputdependent prompt selection and postprocessing, Codex is able to formalise short mathematical statements at undergrad level with nearly 75% accuracy for 120 theorem statements. For proofs quantitative analysis is infeasible and we undertake a detailed case study. We choose a diverse set of 13 theorems at undergrad level with proofs that fit in two-three paragraphs. We show that with a new prompting strategy Codex can formalise these proofs in natural language with at least one out of twelve Codex completion being easy to repair into a complete proof. This is surprising as essentially no aligned data exists for formalised mathematics, particularly for proofs. These results suggest that large language models are a promising avenue towards fully or partially automating formalisation.",arxiv:2211.07524,Yes,,2025-11-11T02:46:38.519Z
unigeounifyinggeomet-2022,UniGeo: Unifying Geometry Logical Reasoning via Reformulating Mathematical Expression,Jiaqi Chen; Tong Li; Jinghui Qin; Pan Lu; Liang Lin; Chongyu Chen; Xiaodan Liang,2022,Conference on Empirical Methods in Natural Language Processing,133,https://www.semanticscholar.org/paper/72fce949725b20428e5f56247fef5c6bd1ce6154,https://arxiv.org/pdf/2212.02746,10.48550/arXiv.2212.02746,"Geometry problem solving is a well-recognized testbed for evaluating the high-level multi-modal reasoning capability of deep models. In most existing works, two main geometry problems: calculation and proving, are usually treated as two specific tasks, hindering a deep model to unify its reasoning capability on multiple math tasks. However, in essence, these two tasks have similar problem representations and overlapped math knowledge which can improve the understanding and reasoning ability of a deep model on both two tasks. Therefore, we construct a large-scale Unified Geometry problem benchmark, UniGeo, which contains 4,998 calculation problems and 9,543 proving problems. Each proving problem is annotated with a multi-step proof with reasons and mathematical expressions. The proof can be easily reformulated as a proving sequence that shares the same formats with the annotated program sequence for calculation problems. Naturally, we also present a unified multi-task Geometric Transformer framework, Geoformer, to tackle calculation and proving problems simultaneously in the form of sequence generation, which finally shows the reasoning ability can be improved on both two tasks by unifying formulation. Furthermore, we propose a Mathematical Expression Pretraining (MEP) method that aims to predict the mathematical expressions in the problem solution, thus improving the Geoformer model. Experiments on the UniGeo demonstrate that our proposed Geoformer obtains state-of-the-art performance by outperforming task-specific model NGS with over 5.6% and 3.2% accuracies on calculation and proving problems, respectively.",arxiv:2212.02746,Yes,,2025-11-11T02:46:38.519Z
unpackinglargelangua-2022,Unpacking Large Language Models with Conceptual Consistency,Pritish Sahu; Michael Cogswell; Yunye Gong; Ajay Divakaran,2022,arXiv.org,18,https://www.semanticscholar.org/paper/4f4a80148cb8f328aeaee68b34f9797cfb5ea150,http://arxiv.org/pdf/2209.15093,10.48550/arXiv.2209.15093,"If a Large Language Model (LLM) answers""yes""to the question""Are mountains tall?""then does it know what a mountain is? Can you rely on it responding correctly or incorrectly to other questions about mountains? The success of Large Language Models (LLMs) indicates they are increasingly able to answer queries like these accurately, but that ability does not necessarily imply a general understanding of concepts relevant to the anchor query. We propose conceptual consistency to measure a LLM's understanding of relevant concepts. This novel metric measures how well a model can be characterized by finding out how consistent its responses to queries about conceptually relevant background knowledge are. To compute it we extract background knowledge by traversing paths between concepts in a knowledge base and then try to predict the model's response to the anchor query from the background knowledge. We investigate the performance of current LLMs in a commonsense reasoning setting using the CSQA dataset and the ConceptNet knowledge base. While conceptual consistency, like other metrics, does increase with the scale of the LLM used, we find that popular models do not necessarily have high conceptual consistency. Our analysis also shows significant variation in conceptual consistency across different kinds of relations, concepts, and prompts. This serves as a step toward building models that humans can apply a theory of mind to, and thus interact with intuitively.",arxiv:2209.15093,Yes,,2025-11-11T02:46:38.519Z
