ID,Title,Authors,Year,Venue,Citations,URL,PDF URL,DOI,Abstract,Keywords,Included,Exclusion Reason,Extracted At
acausalframeworktoqu-2022,A Causal Framework to Quantify the Robustness of Mathematical Reasoning with Language Models,Alessandro Stolfo; Zhijing Jin; Kumar Shridhar; B. Scholkopf; Mrinmaya Sachan,2022,Annual Meeting of the Association for Computational Linguistics,76,https://www.semanticscholar.org/paper/9b45af10429681249fafb07c3b6012ea4ce63ffe,http://arxiv.org/pdf/2210.12023,10.48550/arXiv.2210.12023,"We have recently witnessed a number of impressive results on hard mathematical reasoning problems with language models. At the same time, the robustness of these models has also been called into question; recent works have shown that models can rely on shallow patterns in the problem description when generating a solution.Building on the idea of behavioral testing, we propose a novel framework, which pins down the causal effect of various factors in the input, e.g., the surface form of the problem text, the operands, and math operators on the output solution.By grounding the behavioral analysis in a causal graph describing an intuitive reasoning process, we study the behavior of language models in terms of robustness and sensitivity to direct interventions in the input space. We apply our framework on a test bed of math word problems.Our analysis shows that robustness does not appear to continuously improve as a function of size, but the GPT-3 Davinci models (175B) achieve a dramatic improvement in both robustness and sensitivity compared to all other GPT variants.",arxiv:2210.12023,Yes,,2025-11-11T02:46:38.519Z
asurveyofdeeplearnin-2022,A Survey of Deep Learning for Mathematical Reasoning,Pan Lu; Liang Qiu; Wenhao Yu; S. Welleck; Kai-Wei Chang,2022,Annual Meeting of the Association for Computational Linguistics,166,https://www.semanticscholar.org/paper/2dbec38fe353ab0e495ad09263389dbc9260824d,http://arxiv.org/pdf/2212.10535,10.48550/arXiv.2212.10535,"Mathematical reasoning is a fundamental aspect of human intelligence and is applicable in various fields, including science, engineering, finance, and everyday life. The development of artificial intelligence (AI) systems capable of solving math problems and proving theorems in language has garnered significant interest in the fields of machine learning and natural language processing. For example, mathematics serves as a testbed for aspects of reasoning that are challenging for powerful deep learning models, driving new algorithmic and modeling advances. On the other hand, recent advances in large-scale neural language models have opened up new benchmarks and opportunities to use deep learning for mathematical reasoning. In this survey paper, we review the key tasks, datasets, and methods at the intersection of mathematical reasoning and deep learning over the past decade. We also evaluate existing benchmarks and methods, and discuss future research directions in this domain.",arxiv:2212.10535,Yes,,2025-11-11T02:46:38.519Z
automaticchainofthou-2022,Automatic Chain of Thought Prompting in Large Language Models,Zhuosheng Zhang; Aston Zhang; Mu Li; Alexander J. Smola,2022,International Conference on Learning Representations,779,https://www.semanticscholar.org/paper/90350aa626bed47b02d0c162462e5b0ca82be6b2,,,"Large language models (LLMs) can perform complex reasoning by generating intermediate reasoning steps. Providing these steps for prompting demonstrations is called chain-of-thought (CoT) prompting. CoT prompting has two major paradigms. One leverages a simple prompt like""Let's think step by step""to facilitate step-by-step thinking before answering a question. The other uses a few manual demonstrations one by one, each composed of a question and a reasoning chain that leads to an answer. The superior performance of the second paradigm hinges on the hand-crafting of task-specific demonstrations one by one. We show that such manual efforts may be eliminated by leveraging LLMs with the""Let's think step by step""prompt to generate reasoning chains for demonstrations one by one, i.e., let's think not just step by step, but also one by one. However, these generated chains often come with mistakes. To mitigate the effect of such mistakes, we find that diversity matters for automatically constructing demonstrations. We propose an automatic CoT prompting method: Auto-CoT. It samples questions with diversity and generates reasoning chains to construct demonstrations. On ten public benchmark reasoning tasks with GPT-3, Auto-CoT consistently matches or exceeds the performance of the CoT paradigm that requires manual designs of demonstrations. Code is available at https://github.com/amazon-research/auto-cot",arxiv:2210.03493,Yes,,2025-11-11T02:46:38.519Z
clevrmathadatasetfor-2022,"CLEVR-Math: A Dataset for Compositional Language, Visual and Mathematical Reasoning",Adam Dahlgren Lindström; Savitha Sam Abraham,2022,International Workshop on Neural-Symbolic Learning and Reasoning,80,https://www.semanticscholar.org/paper/74cc3d340039c67bdabaef090d1386fe2c5376ca,http://arxiv.org/pdf/2208.05358,10.48550/arXiv.2208.05358,"We introduce CLEVR-Math, a multi-modal math word problems dataset consisting of simple math word problems involving addition/subtraction, represented partly by a textual description and partly by an image illustrating the scenario. The text describes actions performed on the scene that is depicted in the image. Since the question posed may not be about the scene in the image, but about the state of the scene before or after the actions are applied, the solver envision or imagine the state changes due to these actions. Solving these word problems requires a combination of language, visual and mathematical reasoning. We apply state-of-the-art neural and neuro-symbolic models for visual question answering on CLEVR-Math and empirically evaluate their performances. Our results show how neither method generalise to chains of operations. We discuss the limitations of the two in addressing the task of multi-modal word problem solving.",arxiv:2208.05358,Yes,,2025-11-11T02:46:38.519Z
chainofthoughtprompt-2022,Chain of Thought Prompting Elicits Reasoning in Large Language Models,Jason Wei; Xuezhi Wang; Dale Schuurmans; Maarten Bosma; Ed H. Chi; F. Xia; Quoc Le; Denny Zhou,2022,Neural Information Processing Systems,13165,https://www.semanticscholar.org/paper/1b6e810ce0afd0dd093f789d2b2742d047e316d5,,,"We explore how generating a chain of thought -- a series of intermediate reasoning steps -- significantly improves the ability of large language models to perform complex reasoning. In particular, we show how such reasoning abilities emerge naturally in sufficiently large language models via a simple method called chain of thought prompting, where a few chain of thought demonstrations are provided as exemplars in prompting. Experiments on three large language models show that chain of thought prompting improves performance on a range of arithmetic, commonsense, and symbolic reasoning tasks. The empirical gains can be striking. For instance, prompting a 540B-parameter language model with just eight chain of thought exemplars achieves state of the art accuracy on the GSM8K benchmark of math word problems, surpassing even finetuned GPT-3 with a verifier.",arxiv:2201.11903,Yes,,2025-11-11T02:46:38.519Z
codeaspolicieslangua-2022,Code as Policies: Language Model Programs for Embodied Control,Jacky Liang; Wenlong Huang; F. Xia; Peng Xu; Karol Hausman; Brian Ichter; Peter R. Florence; Andy Zeng,2022,IEEE International Conference on Robotics and Automation,1177,https://www.semanticscholar.org/paper/91deaf9d324c8feafc189da0da03e60a60287bca,https://arxiv.org/pdf/2209.07753,10.1109/ICRA48891.2023.10160591,"Large language models (LLMs) trained on code-completion have been shown to be capable of synthesizing simple Python programs from docstrings [1]. We find that these code-writing LLMs can be re-purposed to write robot policy code, given natural language commands. Specifically, policy code can express functions or feedback loops that process perception outputs (e.g., from object detectors [2], [3]) and parameterize control primitive APIs. When provided as input several example language commands (formatted as comments) followed by corresponding policy code (via few-shot prompting), LLMs can take in new commands and autonomously re-compose API calls to generate new policy code respectively. By chaining classic logic structures and referencing third-party libraries (e.g., NumPy, Shapely) to perform arithmetic, LLMs used in this way can write robot policies that (i) exhibit spatial-geometric reasoning, (ii) generalize to new instructions, and (iii) prescribe precise values (e.g., velocities) to ambiguous descriptions (‘faster’) depending on context (i.e., behavioral commonsense). This paper presents Code as Policies: a robot-centric formulation of language model generated programs (LMPs) that can represent reactive policies (e.g., impedance controllers), as well as waypoint-based policies (vision-based pick and place, trajectory-based control), demonstrated across multiple real robot platforms. Central to our approach is prompting hierarchical code-gen (recursively defining undefined functions), which can write more complex code and also improves state-of-the-art to solve 39.8% of problems on the HumanEval [1] benchmark. Code and videos are available at https://code-as-policies.github.io",arxiv:2209.07753,Yes,,2025-11-11T02:46:38.519Z
distillingmultistepr-2022,Distilling Multi-Step Reasoning Capabilities of Large Language Models into Smaller Models via Semantic Decompositions,Kumar Shridhar; Alessandro Stolfo; Mrinmaya Sachan,2022,arXiv.org,47,https://www.semanticscholar.org/paper/72123a86eae2cb5c4eae8650f43524039d48875d,http://arxiv.org/pdf/2212.00193,10.48550/arXiv.2212.00193,,,Yes,,2025-11-11T02:46:38.519Z
draftsketchandproveg-2022,"Draft, Sketch, and Prove: Guiding Formal Theorem Provers with Informal Proofs",Albert Qiaochu Jiang; S. Welleck; J. Zhou; Wenda Li; Jiacheng Liu; M. Jamnik; Timothée Lacroix; Yuhuai Wu; Guillaume Lample,2022,International Conference on Learning Representations,226,https://www.semanticscholar.org/paper/7de36d6b14aadc8cdb6ad1340b9ca64b15375bca,http://arxiv.org/pdf/2210.12283,10.48550/arXiv.2210.12283,"The formalization of existing mathematical proofs is a notoriously difficult process. Despite decades of research on automation and proof assistants, writing formal proofs remains arduous and only accessible to a few experts. While previous studies to automate formalization focused on powerful search algorithms, no attempts were made to take advantage of available informal proofs. In this work, we introduce Draft, Sketch, and Prove (DSP), a method that maps informal proofs to formal proof sketches, and uses the sketches to guide an automated prover by directing its search to easier sub-problems. We investigate two relevant setups where informal proofs are either written by humans or generated by a language model. Our experiments and ablation studies show that large language models are able to produce well-structured formal sketches that follow the same reasoning steps as the informal proofs. Guiding an automated prover with these sketches enhances its performance from 20.9% to 39.3% on a collection of mathematical competition problems.",arxiv:2210.12283,Yes,,2025-11-11T02:46:38.519Z
dynamicpromptlearnin-2022,Dynamic Prompt Learning via Policy Gradient for Semi-structured Mathematical Reasoning,Pan Lu; Liang Qiu; Kai-Wei Chang; Y. Wu; Song-Chun Zhu; Tanmay Rajpurohit; Peter Clark; A. Kalyan,2022,International Conference on Learning Representations,365,https://www.semanticscholar.org/paper/3e565c544a8639cc9c7568833e484d7610f5e5d4,http://arxiv.org/pdf/2209.14610,10.48550/arXiv.2209.14610,"Mathematical reasoning, a core ability of human intelligence, presents unique challenges for machines in abstract thinking and logical reasoning. Recent large pre-trained language models such as GPT-3 have achieved remarkable progress on mathematical reasoning tasks written in text form, such as math word problems (MWP). However, it is unknown if the models can handle more complex problems that involve math reasoning over heterogeneous information, such as tabular data. To fill the gap, we present Tabular Math Word Problems (TabMWP), a new dataset containing 38,431 open-domain grade-level problems that require mathematical reasoning on both textual and tabular data. Each question in TabMWP is aligned with a tabular context, which is presented as an image, semi-structured text, and a structured table. There are two types of questions: free-text and multi-choice, and each problem is annotated with gold solutions to reveal the multi-step reasoning process. We evaluate different pre-trained models on TabMWP, including the GPT-3 model in a few-shot setting. As earlier studies suggest, since few-shot GPT-3 relies on the selection of in-context examples, its performance is unstable and can degrade to near chance. The unstable issue is more severe when handling complex problems like TabMWP. To mitigate this, we further propose a novel approach, PromptPG, which utilizes policy gradient to learn to select in-context examples from a small amount of training data and then constructs the corresponding prompt for the test example. Experimental results show that our method outperforms the best baseline by 5.31% on the accuracy metric and reduces the prediction variance significantly compared to random selection, which verifies its effectiveness in selecting in-context examples.",arxiv:2209.14610,Yes,,2025-11-11T02:46:38.519Z
emergentanalogicalre-2022,Emergent analogical reasoning in large language models,Taylor W. Webb; K. Holyoak; Hongjing Lu,2022,Nature Human Behaviour,395,https://www.semanticscholar.org/paper/3cbffab9d7981da6662d474aaa056dcbd3c1701e,,10.1038/s41562-023-01659-w,"The recent advent of large language models has reinvigorated debate over whether human cognitive capacities might emerge in such generic models given sufficient training data. Of particular interest is the ability of these models to reason about novel problems zero-shot, without any direct training. In human cognition, this capacity is closely tied to an ability to reason by analogy. Here we performed a direct comparison between human reasoners and a large language model (the text-davinci-003 variant of Generative Pre-trained Transformer (GPT)-3) on a range of analogical tasks, including a non-visual matrix reasoning task based on the rule structure of Raven’s Standard Progressive Matrices. We found that GPT-3 displayed a surprisingly strong capacity for abstract pattern induction, matching or even surpassing human capabilities in most settings; preliminary tests of GPT-4 indicated even better performance. Our results indicate that large language models such as GPT-3 have acquired an emergent ability to find zero-shot solutions to a broad range of analogy problems. Webb et al. show that new artificial intelligence language models, such as Generative Pre-trained Transformer 3, are able to solve analogical reasoning problems at a human-like level of performance.",arxiv:2212.09196,Yes,,2025-11-11T02:46:38.519Z
explanationsfromlarg-2022,Explanations from Large Language Models Make Small Reasoners Better,SHIYANG LI; Jianshu Chen; Yelong Shen; Zhiyu Chen; Xinlu Zhang; Zekun Li; Hong Wang; Jingu Qian; Baolin Peng; Yi Mao; Wenhu Chen; Xifeng Yan,2022,arXiv.org,150,https://www.semanticscholar.org/paper/7d29a84a589aa5655e5d3fed8d725ea472816599,http://arxiv.org/pdf/2210.06726,10.48550/arXiv.2210.06726,"Integrating free-text explanations to in-context learning of large language models (LLM) is shown to elicit strong reasoning capabilities along with reasonable explanations. In this paper, we consider the problem of leveraging the explanations generated by LLM to improve the training of small reasoners, which are more favorable in real-production deployment due to their low cost. We systematically explore three explanation generation approaches from LLM and utilize a multi-task learning framework to facilitate small models to acquire strong reasoning power together with explanation generation capabilities. Experiments on multiple reasoning tasks show that our method can consistently and significantly outperform finetuning baselines across different settings, and even perform better than finetuning/prompting a 60x larger GPT-3 (175B) model by up to 9.5% in accuracy. As a side benefit, human evaluation further shows that our method can generate high-quality explanations to justify its predictions, moving towards the goal of explainable AI.",arxiv:2210.06726,Yes,,2025-11-11T02:46:38.519Z
exploringlengthgener-2022,Exploring Length Generalization in Large Language Models,Cem Anil; Yuhuai Wu; Anders Andreassen; Aitor Lewkowycz; Vedant Misra; V. Ramasesh; Ambrose Slone; Guy Gur-Ari; Ethan Dyer; Behnam Neyshabur,2022,Neural Information Processing Systems,196,https://www.semanticscholar.org/paper/f843233f76a5dff07bfa93a71a1cf13d8aa6a94a,http://arxiv.org/pdf/2207.04901,10.48550/arXiv.2207.04901,"The ability to extrapolate from short problem instances to longer ones is an important form of out-of-distribution generalization in reasoning tasks, and is crucial when learning from datasets where longer problem instances are rare. These include theorem proving, solving quantitative mathematics problems, and reading/summarizing novels. In this paper, we run careful empirical studies exploring the length generalization capabilities of transformer-based language models. We first establish that naively finetuning transformers on length generalization tasks shows significant generalization deficiencies independent of model scale. We then show that combining pretrained large language models' in-context learning abilities with scratchpad prompting (asking the model to output solution steps before producing an answer) results in a dramatic improvement in length generalization. We run careful failure analyses on each of the learning modalities and identify common sources of mistakes that highlight opportunities in equipping language models with the ability to generalize to longer problems.",arxiv:2207.04901,Yes,,2025-11-11T02:46:38.519Z
faithfulreasoningusi-2022,Faithful Reasoning Using Large Language Models,Antonia Creswell; M. Shanahan,2022,arXiv.org,133,https://www.semanticscholar.org/paper/f0a0e8b6e84207f50db4d24cc4016e40601214ef,,,"Although contemporary large language models (LMs) demonstrate impressive question-answering capabilities, their answers are typically the product of a single call to the model. This entails an unwelcome degree of opacity and compromises performance, especially on problems that are inherently multi-step. To address these limitations, we show how LMs can be made to perform faithful multi-step reasoning via a process whose causal structure mirrors the underlying logical structure of the problem. Our approach works by chaining together reasoning steps, where each step results from calls to two fine-tuned LMs, one for selection and one for inference, to produce a valid reasoning trace. Our method carries out a beam search through the space of reasoning traces to improve reasoning quality. We demonstrate the effectiveness of our model on multi-step logical deduction and scientific question-answering, showing that it outperforms baselines on final answer accuracy, and generates humanly interpretable reasoning traces whose validity can be checked by the user.",arxiv:2208.14271,Yes,,2025-11-11T02:46:38.519Z
galacticaalargelangu-2022,Galactica: A Large Language Model for Science,Ross Taylor; Marcin Kardas; Guillem Cucurull; Thomas Scialom; A. Hartshorn; Elvis Saravia; Andrew Poulton; Viktor Kerkez; Robert Stojnic,2022,arXiv.org,892,https://www.semanticscholar.org/paper/7d645a3fd276918374fd9483fd675c28e46506d1,,,"Information overload is a major obstacle to scientific progress. The explosive growth in scientific literature and data has made it ever harder to discover useful insights in a large mass of information. Today scientific knowledge is accessed through search engines, but they are unable to organize scientific knowledge alone. In this paper we introduce Galactica: a large language model that can store, combine and reason about scientific knowledge. We train on a large scientific corpus of papers, reference material, knowledge bases and many other sources. We outperform existing models on a range of scientific tasks. On technical knowledge probes such as LaTeX equations, Galactica outperforms the latest GPT-3 by 68.2% versus 49.0%. Galactica also performs well on reasoning, outperforming Chinchilla on mathematical MMLU by 41.3% to 35.7%, and PaLM 540B on MATH with a score of 20.4% versus 8.8%. It also sets a new state-of-the-art on downstream tasks such as PubMedQA and MedMCQA dev of 77.6% and 52.9%. And despite not being trained on a general corpus, Galactica outperforms BLOOM and OPT-175B on BIG-bench. We believe these results demonstrate the potential for language models as a new interface for science. We open source the model for the benefit of the scientific community.",arxiv:2211.09085,Yes,,2025-11-11T02:46:38.517Z
humanlikeintuitivebe-2022,Human-like intuitive behavior and reasoning biases emerged in large language models but disappeared in ChatGPT,Thilo Hagendorff; Sarah Fabi; Michal Kosinski,2022,Nature Computational Science,202,https://www.semanticscholar.org/paper/0bfc05adcddd4fe5d1335d96cc313c41526d4558,https://www.nature.com/articles/s43588-023-00527-x.pdf,10.1038/s43588-023-00527-x,"We design a battery of semantic illusions and cognitive reflection tests, aimed to elicit intuitive yet erroneous responses. We administer these tasks, traditionally used to study reasoning and decision-making in humans, to OpenAI’s generative pre-trained transformer model family. The results show that as the models expand in size and linguistic proficiency they increasingly display human-like intuitive system 1 thinking and associated cognitive errors. This pattern shifts notably with the introduction of ChatGPT models, which tend to respond correctly, avoiding the traps embedded in the tasks. Both ChatGPT-3.5 and 4 utilize the input–output context window to engage in chain-of-thought reasoning, reminiscent of how people use notepads to support their system 2 thinking. Yet, they remain accurate even when prevented from engaging in chain-of-thought reasoning, indicating that their system-1-like next-word generation processes are more accurate than those of older models. Our findings highlight the value of applying psychological methodologies to study large language models, as this can uncover previously undetected emergent characteristics. The reasoning capabilities of OpenAI’s generative pre-trained transformer family were tested using semantic illusions and cognitive reflection tests that are typically used in human studies. While early models were prone to human-like cognitive errors, ChatGPT decisively outperformed humans, avoiding the cognitive traps embedded in the tasks.",arxiv:2306.07622,Yes,,2025-11-11T02:46:38.519Z
lilaaunifiedbenchmar-2022,LILA: A Unified Benchmark for Mathematical Reasoning,Swaroop Mishra; Matthew Finlayson; Pan Lu; Leonard Tang; S. Welleck; Chitta Baral; Tanmay Rajpurohit; Oyvind Tafjord; Ashish Sabharwal; Peter Clark; A. Kalyan,2022,Conference on Empirical Methods in Natural Language Processing,150,https://www.semanticscholar.org/paper/52fb239ea5cea1e9a2636f8f7922c8ede3e50ba7,http://arxiv.org/pdf/2210.17517,10.48550/arXiv.2210.17517,"Mathematical reasoning skills are essential for general-purpose intelligentsystems to perform tasks from grocery shopping to climate modeling.Towards evaluating and improving AI systems in this domain, we proposeLILA, a unified mathematical reasoning benchmark consisting of 23 diversetasks along four dimensions:(i) mathematical abilities e.g., arithmetic, calculus (ii) language format e.g., question-answering, fill-in-the-blanks (iii) language diversity e.g., no language, simple language (iv) external knowledge e.g., commonsense, physics. We construct our benchmark by extending 20 datasets benchmark by collecting task instructions and solutions in the form of Python programs,thereby obtaining explainable solutions in addition to the correct answer.We additionally introduce two evaluation datasets to measure out-of-distribution performance and robustness to language perturbation.Finally, we introduce BHASKARA,a general-purpose mathematical reasoning model trained on LILA. Importantly, we find that multi-tasking leads to significant improvements (average relative improvement of 21.83% F1 score vs. single-task models),while the best performing model only obtains 60.40%,indicating the room for improvement in general mathematical reasoning and understanding.",,Yes,,2025-11-11T02:46:38.519Z
